{
  "schemaVersion": 1,
  "edition": "bedrock",
  "title": "天空トラップタワー",
  "summary": "統合版・演算距離4チャンク用。湧き層4段、落下21ブロックで瀕死にして、自分でとどめを刺して経験値を取ります。待機部屋の奥で待ち、倒すときだけ前に出ます。",
  "tags": [
    "トラップ",
    "経験値",
    "天空"
  ],
  "palette": {
    "stone": {
      "name": "建材ブロック（丸石など）",
      "color": "#8d949a",
      "item": "建材ブロック",
      "mc": "minecraft:cobblestone"
    },
    "pad": {
      "name": "湧き床（建材と同じでOK）",
      "color": "#6d7c8c",
      "item": "建材ブロック",
      "mc": "minecraft:cobblestone"
    },
    "guard": {
      "name": "1層目の落下防止壁（建材）",
      "color": "#7d8a73",
      "item": "建材ブロック",
      "mc": "minecraft:cobblestone"
    },
    "slabB": {
      "name": "ハーフ（下付き）",
      "color": "#b9bec2",
      "shape": "slabBottom",
      "label": "下",
      "item": "ハーフブロック",
      "mc": "minecraft:smooth_stone_slab"
    },
    "slabT": {
      "name": "ハーフ（上付き）",
      "color": "#d3d7da",
      "shape": "slabTop",
      "label": "上",
      "item": "ハーフブロック",
      "mc": "minecraft:smooth_stone_slab"
    },
    "trapdoor": {
      "name": "トラップドア（開ける）",
      "color": "#a0703a",
      "shape": "trapdoor",
      "item": "木のトラップドア",
      "mc": "minecraft:trapdoor"
    },
    "hopper": {
      "name": "ホッパー",
      "color": "#4a4e54",
      "mc": "minecraft:hopper"
    },
    "carpet": {
      "name": "カーペット",
      "color": "#c9453a",
      "shape": "carpet",
      "mc": "minecraft:red_carpet"
    },
    "chest": {
      "name": "チェスト",
      "color": "#b8832c",
      "mc": "minecraft:chest"
    },
    "water": {
      "name": "水源",
      "color": "#2f6ad8",
      "shape": "liquid",
      "mc": "minecraft:water"
    },
    "flow": {
      "name": "流れる水（置かない）",
      "color": "#8fbcf2",
      "shape": "flowing",
      "count": false
    },
    "torch": {
      "name": "松明",
      "color": "#f3c33a",
      "shape": "torch",
      "mc": "minecraft:torch"
    }
  },
  "ops": [
    {"fill":[[-3,-2,-8],[3,-2,-2]],"t":"slabB"},
    {"fill":[[-3,0,-8],[3,0,-2]],"t":"slabT"},
    {"fill":[[-4,-2,-9],[4,0,-9]],"t":"stone"},
    {"fill":[[-4,-2,-9],[-4,0,-1]],"t":"stone"},
    {"fill":[[4,-2,-9],[4,0,-1]],"t":"stone"},
    {"fill":[[-3,-2,-1],[-2,0,-1]],"t":"stone"},
    {"fill":[[2,-2,-1],[3,0,-1]],"t":"stone"},
    {"set":[-2,-1,-2],"t":"chest"},
    {"set":[-3,-1,-2],"t":"chest"},
    {"fill":[[-1,-1,0],[1,-1,1]],"t":"hopper","d":"N"},
    {"fill":[[-1,-1,-1],[1,-1,-1]],"t":"hopper","d":"W"},
    {"fill":[[-1,-2,-1],[1,-2,1]],"t":"stone"},
    {"set":[-2,-1,-1],"t":"hopper","d":"N"},
    {"fill":[[-2,-1,0],[-2,-1,1]],"t":"stone"},
    {"fill":[[2,-1,0],[2,-1,1]],"t":"stone"},
    {"fill":[[-2,-1,2],[2,-1,2]],"t":"stone"},
    {"set":[2,-1,-1],"t":"stone"},
    {"fill":[[-1,0,-1],[1,0,1]],"t":"carpet"},
    {"walls":[[-2,0,-2],[2,20,2]],"t":"stone","keep":true},
    {"fill":[[-9,20,-1],[-2,20,1]],"t":"stone"},
    {"fill":[[2,20,-1],[9,20,1]],"t":"stone"},
    {"fill":[[-8,21,-1],[-2,21,1]],"t":"flow"},
    {"fill":[[2,21,-1],[8,21,1]],"t":"flow"},
    {"fill":[[-9,21,-1],[-9,21,1]],"t":"water"},
    {"fill":[[9,21,-1],[9,21,1]],"t":"water"},
    {"fill":[[-10,21,-2],[10,21,-2]],"t":"stone"},
    {"fill":[[-10,21,2],[10,21,2]],"t":"stone"},
    {"fill":[[-10,20,-1],[-10,21,1]],"t":"stone"},
    {"fill":[[10,20,-1],[10,21,1]],"t":"stone"},
    {"fill":[[-9,22,-8],[9,22,-2]],"t":"pad"},
    {"fill":[[-9,22,2],[9,22,8]],"t":"pad"},
    {"set":[2,22,1],"t":"trapdoor","d":"S"},
    {"set":[2,22,-1],"t":"trapdoor","d":"N"},
    {"set":[-2,22,1],"t":"trapdoor","d":"S"},
    {"set":[-2,22,-1],"t":"trapdoor","d":"N"},
    {"set":[4,22,1],"t":"trapdoor","d":"S"},
    {"set":[4,22,-1],"t":"trapdoor","d":"N"},
    {"set":[-4,22,1],"t":"trapdoor","d":"S"},
    {"set":[-4,22,-1],"t":"trapdoor","d":"N"},
    {"set":[6,22,1],"t":"trapdoor","d":"S"},
    {"set":[6,22,-1],"t":"trapdoor","d":"N"},
    {"set":[-6,22,1],"t":"trapdoor","d":"S"},
    {"set":[-6,22,-1],"t":"trapdoor","d":"N"},
    {"set":[8,22,1],"t":"trapdoor","d":"S"},
    {"set":[8,22,-1],"t":"trapdoor","d":"N"},
    {"set":[-8,22,1],"t":"trapdoor","d":"S"},
    {"set":[-8,22,-1],"t":"trapdoor","d":"N"},
    {"fill":[[-9,25,-8],[9,25,-2]],"t":"pad"},
    {"fill":[[-9,25,2],[9,25,8]],"t":"pad"},
    {"fill":[[-1,25,-1],[1,25,1]],"t":"pad"},
    {"set":[3,25,1],"t":"trapdoor","d":"S"},
    {"set":[3,25,-1],"t":"trapdoor","d":"N"},
    {"set":[-3,25,1],"t":"trapdoor","d":"S"},
    {"set":[-3,25,-1],"t":"trapdoor","d":"N"},
    {"set":[5,25,1],"t":"trapdoor","d":"S"},
    {"set":[5,25,-1],"t":"trapdoor","d":"N"},
    {"set":[-5,25,1],"t":"trapdoor","d":"S"},
    {"set":[-5,25,-1],"t":"trapdoor","d":"N"},
    {"set":[7,25,1],"t":"trapdoor","d":"S"},
    {"set":[7,25,-1],"t":"trapdoor","d":"N"},
    {"set":[-7,25,1],"t":"trapdoor","d":"S"},
    {"set":[-7,25,-1],"t":"trapdoor","d":"N"},
    {"set":[9,25,1],"t":"trapdoor","d":"S"},
    {"set":[9,25,-1],"t":"trapdoor","d":"N"},
    {"set":[-9,25,1],"t":"trapdoor","d":"S"},
    {"set":[-9,25,-1],"t":"trapdoor","d":"N"},
    {"fill":[[-9,28,-8],[9,28,-2]],"t":"pad"},
    {"fill":[[-9,28,2],[9,28,8]],"t":"pad"},
    {"fill":[[-1,28,-1],[1,28,1]],"t":"pad"},
    {"set":[2,28,1],"t":"trapdoor","d":"S"},
    {"set":[2,28,-1],"t":"trapdoor","d":"N"},
    {"set":[-2,28,1],"t":"trapdoor","d":"S"},
    {"set":[-2,28,-1],"t":"trapdoor","d":"N"},
    {"set":[4,28,1],"t":"trapdoor","d":"S"},
    {"set":[4,28,-1],"t":"trapdoor","d":"N"},
    {"set":[-4,28,1],"t":"trapdoor","d":"S"},
    {"set":[-4,28,-1],"t":"trapdoor","d":"N"},
    {"set":[6,28,1],"t":"trapdoor","d":"S"},
    {"set":[6,28,-1],"t":"trapdoor","d":"N"},
    {"set":[-6,28,1],"t":"trapdoor","d":"S"},
    {"set":[-6,28,-1],"t":"trapdoor","d":"N"},
    {"set":[8,28,1],"t":"trapdoor","d":"S"},
    {"set":[8,28,-1],"t":"trapdoor","d":"N"},
    {"set":[-8,28,1],"t":"trapdoor","d":"S"},
    {"set":[-8,28,-1],"t":"trapdoor","d":"N"},
    {"fill":[[-9,31,-8],[9,31,-2]],"t":"pad"},
    {"fill":[[-9,31,2],[9,31,8]],"t":"pad"},
    {"fill":[[-1,31,-1],[1,31,1]],"t":"pad"},
    {"set":[3,31,1],"t":"trapdoor","d":"S"},
    {"set":[3,31,-1],"t":"trapdoor","d":"N"},
    {"set":[-3,31,1],"t":"trapdoor","d":"S"},
    {"set":[-3,31,-1],"t":"trapdoor","d":"N"},
    {"set":[5,31,1],"t":"trapdoor","d":"S"},
    {"set":[5,31,-1],"t":"trapdoor","d":"N"},
    {"set":[-5,31,1],"t":"trapdoor","d":"S"},
    {"set":[-5,31,-1],"t":"trapdoor","d":"N"},
    {"set":[7,31,1],"t":"trapdoor","d":"S"},
    {"set":[7,31,-1],"t":"trapdoor","d":"N"},
    {"set":[-7,31,1],"t":"trapdoor","d":"S"},
    {"set":[-7,31,-1],"t":"trapdoor","d":"N"},
    {"set":[9,31,1],"t":"trapdoor","d":"S"},
    {"set":[9,31,-1],"t":"trapdoor","d":"N"},
    {"set":[-9,31,1],"t":"trapdoor","d":"S"},
    {"set":[-9,31,-1],"t":"trapdoor","d":"N"},
    {"fill":[[-1,23,-1],[1,24,-1]],"t":"guard"},
    {"fill":[[-1,23,1],[1,24,1]],"t":"guard"},
    {"walls":[[-10,22,-9],[10,33,9]],"t":"stone","keep":true},
    {"fill":[[-10,34,-9],[10,34,9]],"t":"stone"},
    {"set":[-6,35,-5],"t":"torch"},
    {"set":[-6,35,5],"t":"torch"},
    {"set":[0,35,-5],"t":"torch"},
    {"set":[0,35,5],"t":"torch"},
    {"set":[6,35,-5],"t":"torch"},
    {"set":[6,35,5],"t":"torch"},
    {"clear":[[0,-1,-9],[0,0,-9]]}
  ],
  "layerNames": {
    "0": "カーペット・すき間の天井",
    "1": "落下の筒",
    "2": "落下の筒",
    "3": "落下の筒",
    "4": "落下の筒",
    "5": "落下の筒",
    "6": "落下の筒",
    "7": "落下の筒",
    "8": "落下の筒",
    "9": "落下の筒",
    "10": "落下の筒",
    "11": "落下の筒",
    "12": "落下の筒",
    "13": "落下の筒",
    "14": "落下の筒",
    "15": "落下の筒",
    "16": "落下の筒",
    "17": "落下の筒",
    "18": "落下の筒",
    "19": "落下の筒",
    "20": "水路の床",
    "21": "水路の水",
    "22": "1層目の床・トラップドア",
    "23": "1層目の壁・落下防止壁",
    "24": "1層目の壁・落下防止壁",
    "25": "2層目の床・トラップドア",
    "26": "2層目の壁",
    "27": "2層目の壁",
    "28": "3層目の床・トラップドア",
    "29": "3層目の壁",
    "30": "3層目の壁",
    "31": "4層目の床・トラップドア",
    "32": "4層目の壁",
    "33": "4層目の壁",
    "34": "屋根",
    "35": "屋根の松明",
    "-2": "待機部屋の床",
    "-1": "ホッパー・チェスト"
  },
  "markers": [
    {
      "pos": [0,-1.5,-7],
      "label": "待つ場所",
      "style": "solid"
    },
    {
      "pos": [0,-1.5,-2],
      "label": "倒すときに立つ場所",
      "style": "ghost"
    }
  ],
  "views": [
    {
      "id": "all",
      "label": "全体",
      "caption": "南西の上から",
      "camera": [-90,70,90],
      "target": [0,16,0],
      "size": 46
    },
    {
      "id": "cut",
      "label": "断面",
      "caption": "東半分を外した断面",
      "clip": {
        "x": [null,0]
      },
      "camera": [120,20,40],
      "target": [0,16,0],
      "size": 46
    },
    {
      "id": "room",
      "label": "待機部屋",
      "caption": "待機部屋（天井と北の壁を外した図）",
      "clip": {
        "y": [null,3],
        "z": [-8,null]
      },
      "exclude": [
        "slabT"
      ],
      "camera": [40,32,-60],
      "target": [0,-0.5,-4],
      "size": 17
    }
  ],
  "sideView": {
    "slice": "x",
    "at": 0,
    "alsoShow": [{"t":"trapdoor","at":2}],
    "labels": [[0,"0 着地"],[21,"21 水路"],[23,"23 1層"],[26,"26 2層"],[29,"29 3層"],[32,"32 4層"],[35,"35 屋根"],[-1.5,"-1.5 床"]]
  },
  "notes": {
    "viewer": "ドラッグで回転、ピンチ・ホイールで拡大。濃い赤の柱が待つ場所、薄い赤が倒すときに立つ場所です。",
    "side": "高さ0はホッパーの上面（モブが落ちてくる面）です。",
    "plan": "上が北。筒の中心を (0, 0) にしています。待機部屋は筒の北側です。ホッパーの矢印は向き。"
  },
  "materials": {
    "notes": {
      "建材ブロック": "湧き床・壁・筒すべて。丸石など不透過ブロックなら何でも",
      "ハーフブロック": "下付き{slabB}・上付き{slabT}",
      "ホッパー": "鉄インゴット{n*5}個",
      "カーペット": "色は何でも。経験値がホッパーに詰まるのを防ぐ",
      "チェスト": "ラージチェスト1つ",
      "水源": "水バケツ2つで無限水源を作ると楽",
      "松明": "屋根の上用。作業中の仮置き分は別"
    },
    "extra": [
      {
        "name": "はしご",
        "count": "約45個〜",
        "note": "地面から待機部屋までの高さ分"
      }
    ]
  },